,Date,User,Tweet,Keyword
196,2021-06-17 02:20:00+00:00,kathmandupost,"Flood devastation in Melamchi not only because of rains

Experts say the mayhem in the first week of monsoon is quite concerning and with ‘above normal’ rainfall predicted this time, the situation could go worse.
https://t.co/tF2DbINo7w — by @CK_Mandal",flood
197,2020-03-15 00:05:00+00:00,kathmandupost,"Surkhet administration starts eviction of flood victims from public land

Five and a half years since the tragedy struck, victims are still looking for help from the government.
https://t.co/F2brtVHATQ — by Chandani Kathayat",flood
198,2018-07-17 04:55:00+00:00,kathmandupost,"The recent flood, landslide and inundation damaged property worth Rs 119.35 million in Bhaktapur

#KathmanduPost

https://t.co/ZB8E0rNFY6",flood
199,2022-12-09 04:15:00+00:00,kathmandupost,"Paddy production hit after flooding becomes more frequent in Bhajani

Nearly 20,000 families were affected by the floods and inundation in several districts in September. 

https://t.co/lmlrHGwqD6 — by  Mohan Budhaair",flood
200,2018-12-14 05:45:00+00:00,kathmandupost,"Indian security personnel have refused to repatriate three one-horned rhinos swept across the border from Chitwan National Park during floods six months ago

https://t.co/Cks1chRnU6",flood
201,2022-10-08 18:15:00+00:00,kathmandupost,"Floods, landslides turn deadly in several districts

October rains damage houses and crops in places. Life is thrown out of gear as Nepalis engage in their biggest festivities.

https://t.co/f5TD3zc3yz",flood
202,2021-09-10 00:15:00+00:00,kathmandupost,"Bullion market glitters as lockdown blues wear off

The flood of gold imports is a sign of rapidly rising consumer confidence and economic rebound, insiders say.

https://t.co/N8IeKWVDok — by @PrasainKrishana",flood
203,2021-08-26 21:45:00+00:00,kathmandupost,"Melamchi floods leave Helambu residents in hardship

Several settlements in Helambu have been cut off from the rest of the district after the floods swept away roads. 

https://t.co/ibG1IZ2qGT — by Anish Tiwari",flood
204,2022-08-10 00:15:00+00:00,kathmandupost,"Floods damage homes, displace families in Dolakha

Floods triggered by bursting of a recharge pond damaged 10 houses at Bhimeshwar Municipality on Sunday.

https://t.co/YV8D2koHpw — by Kedar Shiwakoti",flood
205,2020-07-09 07:15:00+00:00,kathmandupost,"Floods inundate settlements in Kanchanpur and Banke districts

Lack of proper drainage and encroachment of public land cause inundation in Kanchanpur every monsoon.
https://t.co/CQwa1uBWKX — by Bhawani Bhatta",flood
206,2019-07-21 05:55:00+00:00,kathmandupost,Essential medicines worth millions of rupees stocked at various health facilities in Province 2 have been damaged in recent floods that inundated most parts of the eight Tarai districts. https://t.co/eAj5INMM0A — by @arjunpoudeltkp,flood
207,2023-05-18 13:24:42+00:00,kathmandupost,"Nine dead in northern Italy floods, Formula One race called off

Authorities say flooding had hit 37 towns and communities and around 120 landslides had been registered.

https://t.co/dEqPN2mcHd",flood
208,2021-06-29 06:15:00+00:00,kathmandupost,"Monsoon also means police have to cope with the rains and this affects their work

The police are the first responders during floods and landslides but stations across the country are yet to be built since the 2015 earthquakes.

https://t.co/NNwkGcxzlR — by @dhungana_shuvam",flood
209,2023-05-01 17:15:00+00:00,kathmandupost,"Landslide in Arun III dam highlights threats to Nepal’s hydropower projects

Officials say risk of flash flood has subsided as the river overflows from the project’s dam. https://t.co/avdj4RqMNG — by @arjunpoudeltkp",flood
210,2020-07-23 09:50:00+00:00,kathmandupost,"Geologists visit Kerung Tso lake in China after a surge in water level

On Tuesday, a team of Chinese geologists went to the site to study the possibility of a flood on the Bhotekoshi river.
https://t.co/vAoCrZH0tq — by Anish Tiwari",flood
211,2022-11-01 02:25:00+00:00,kathmandupost,"Between droughts and deluges

Nepal has of late witnessed deluges, unseasonal flash floods and landslides, long droughts and avalanches.

https://t.co/GCfhQoOHBf — by @arpanshr",flood
212,2021-05-10 13:30:00+00:00,kathmandupost,"Air pollution not only impacts health, but can also trigger floods and landslides, study finds

https://t.co/SO1FjFKs86 — by @CK_Mandal",flood
213,2022-08-21 08:45:00+00:00,kathmandupost,"Floods and landslides triggered by intense monsoon rains killed at least 50 people in northern and eastern India over the last three days, officials said on Sunday.

https://t.co/G48jmUEEKG",flood
214,2021-03-05 06:30:00+00:00,kathmandupost,"Floods, landslides plague people living on banks of Budhiganga

Local residents living in disaster-risk zones have been requesting relocation to safer areas but authorities are yet to come forward with a plan. https://t.co/lEvZ8HaykT — by Arjun Shah and @bajhangimitra",flood
215,2020-08-21 03:45:00+00:00,kathmandupost,"Flood victims of Bhajani still seeking safe shelter

More than 550 families displaced by flood in July have moved to a community forest area from the Postal Highway.
https://t.co/RaMVVekt19 — by Mohan Budhaair",flood
216,2021-06-16 07:14:34+00:00,kathmandupost,"Flooded Dordi Khola sweeps away 14 houses in Lamjung

According to Dordi Rural Municipality officials, around 150 houses in the area are at high risk of floods from Dordi Khola.
https://t.co/yLE00UWdDp — by Aash Gurung",flood
217,2023-02-22 21:45:00+00:00,kathmandupost,"Bajhang flood victims struggling for justice for over two decades

Around 165 families were relocated to Kailali but 20 years later, they are still landless. 

https://t.co/V0eHF160I3 — by DR Pant",flood
218,2022-08-31 11:31:06+00:00,kathmandupost,"Pakistan urged to open up India route to flood aid

Resulting flash floods have swept away homes, businesses, infrastructure and crops. The government says 33 million people, or 15 percent of the 220 million-strong South Asian nation, have been affected.

https://t.co/ELIUzwYEVq",flood
219,2021-06-20 18:15:00+00:00,kathmandupost,"Families displaced by Melamchi floods refuse Covid-19 tests fearing separation

Around 600 people in Melamchi and 400 in Helambu are living in makeshift camps for flood displaced. https://t.co/WhUsNYNUAZ — by @arjunpoudeltkp",flood
220,2022-09-15 19:45:00+00:00,kathmandupost,"OPINION: Climate inaction and policy failures

The floods that ravaged Pakistan are a consequence of unanswered global wakeup calls.

https://t.co/kWfzvSHRiW — by @madhukaru",flood
221,2023-01-20 06:00:31+00:00,kathmandupost,"The area, which is one of the last remaining slums in the East-Asian nation, has been prone to fires, floods and disasters, with many homes built using cardboard and wood, and residents exposed to safety and health issues.

https://t.co/6pGLaYcTD7",flood
222,2021-12-10 05:35:00+00:00,kathmandupost,"Last year’s flood victims from Dhorpatan still await relief

Several government officials had reached the flood- and landslide-hit areas and announced relief packages but none of the promised funds has come through. https://t.co/XLwlx64bty — by Prakash Baral",flood
223,2019-07-15 05:05:00+00:00,kathmandupost,"Hundreds of squatter families living on the riverbank in Thapathali couldn't sleep as two days of incessant rain had caused the Bagmati floods to swamp their settlement.
https://t.co/xivakEnkiS — by @AnupOjha7",flood
224,2022-10-25 12:15:00+00:00,kathmandupost,"The Karnali Highway which was disrupted at several places by floods and landslides triggered by incessant rains in the first week of October has come into operation fully after 17 days of disruption.

https://t.co/o0TqPOxeAl",flood
225,2021-06-20 23:15:00+00:00,kathmandupost,"Tamakoshi riverside settlements at risk of inundation as tributary is dammed up

Ramechhap and Sindhuli district administrations also alert people living close to the river against possible floods. https://t.co/5ctD2Oozqj — by Kedar Shiwakoti",flood
226,2021-06-23 18:45:00+00:00,kathmandupost,"Conservationists blame exploitation of forest and riverbed materials in the Chure region for the incidents of floods and landslides occurring frequently in recent years. 

https://t.co/3MjcTYXmZQ — by Bhawani Bhatta &amp; Mohan Budhaair",flood
227,2020-03-05 09:35:00+00:00,kathmandupost,"Ignoring risks of flood, locals are constructing houses at the banks of Mahakali in Darchula

A construction guideline was issued after the 2015 earthquakes, but it hasn’t been fully implemented yet. https://t.co/2k8JNImKrX — by Manoj Badu",flood
228,2022-05-24 09:25:00+00:00,kathmandupost,"Floods kill 25 in India’s Assam, displace thousands

https://t.co/qKGtR6jMIi",flood
229,2020-08-04 03:45:00+00:00,kathmandupost,"Landslides, floods caused damages worth over Rs2 billion on national highways

Unplanned construction of rural roads and earthquake-hit geology blamed for the damages.

https://t.co/DW9GRJlmlx — by @journoprithvi",flood
230,2020-09-04 05:45:00+00:00,kathmandupost,Fourteen people died while at least 41 others went missing in Wednesday night's flood and landslide in Dhorpatan Municipality. https://t.co/CgfB0700Qv — by Prakash Baral,flood
231,2022-12-26 04:15:30+00:00,kathmandupost,"Surkhet children displaced by floods are dropping out of schools

Several children living in the camp are deprived of formal education for financial difficulties.

https://t.co/ikm4un6SYC — by Tripti Shahi",flood
232,2020-03-14 21:45:00+00:00,kathmandupost,"Floods and erosions threaten settlement built for former bonded labourers in Kanchanpur

https://t.co/C5vkyB5Pa4 — by Bhawani Bhatta",flood
233,2020-07-12 00:45:00+00:00,kathmandupost,Hydropower plants temporarily halt output as floods wreak havoc across Nepal https://t.co/01XlXs7I7V,flood
234,2023-02-15 08:45:00+00:00,kathmandupost,"North Korean food shortage seems to be worsening, South Korea says

North Korea has over recent decades suffered serious food shortages, including famine in the 1990s, often a result of natural disasters such as floods damaging harvests.

https://t.co/YzRdIa0j5Q",flood
235,2020-09-03 06:08:10+00:00,kathmandupost,"Overnight flood, landslides in Baglung claim eight lives; 13 still missing

Security personnel facing a hard time conducting search of the missing individuals because of continuous rainfall in the area.
https://t.co/CgfB0700Qv — by Prakash Baral",flood
236,2021-09-22 04:45:00+00:00,kathmandupost,"Bheri Babai project delayed due to damage

Hit by flood, the multi-basin irrigation-cum-hydropower project located in Surkhet is slated to be ready only in 2024.

https://t.co/jRMpqwAqHD — by Krishna Prasad Gautam &amp; Harihar Singh Rathore",flood
237,2021-07-22 09:45:00+00:00,kathmandupost,"Deadly floods that have upended life in both China and Germany have sent a stark reminder that climate change is making weather more extreme across the globe.

https://t.co/iUBQxHvymQ",flood
238,2018-09-12 14:25:59+00:00,kathmandupost,"Two people died and four others have gone missing in the floods and landslides triggered by torrential rainfall in Lamjung district.

https://t.co/0pFt1J69hl",flood
239,2021-03-29 23:49:00+00:00,kathmandupost,"Flood-displaced families in Myagdi await relocation

It’s been almost a year since the disaster but the displaced families are still living in temporary huts.
https://t.co/cHMPG7PJtB — by Ghanashyam Khadka",flood
240,2020-02-28 22:15:00+00:00,kathmandupost,"Flood fear looms over villages close to vulnerable embankments in Rautahat

Government has not released funds to repair the embankments damaged in last year’s monsoon, officials say. https://t.co/QSklazCn3R — by Shiva Puri",flood
241,2019-07-12 15:45:22+00:00,kathmandupost,"Incessant rainfall, beginning Thursday night and continuing well into Friday, triggered floods and landslides across the country, killing at least 17 people, with six missing. https://t.co/R5qx3MwvJM — by @CK_Mandal &amp; @AnupOjha7",flood
242,2018-07-13 02:15:00+00:00,kathmandupost,"Three members of a family died in a landslide while more than 3,000 people were displaced temporarily due to floods on the Hanumante river following torrential rains in Bhaktapur

#KathmanduPost

https://t.co/68Sqnvatp4",flood
243,2018-08-07 20:48:00+00:00,kathmandupost,"Havoc as wild weather floods parts of Valley
#KathmanduPost
https://t.co/JP6AQvbogp",flood
244,2019-07-19 09:30:17+00:00,kathmandupost,"Heavy rainfall over the past few days has caused floods and landslides across South Asia, killing scores of people and rendering millions homeless. 
These photos show the impact: https://t.co/MGyylcAQSx",flood
245,2022-12-26 20:45:00+00:00,kathmandupost,"Surkhet children displaced by floods are dropping out of schools

Several children living in the camp are deprived of formal education for financial difficulties.

https://t.co/LV0UWmrews — by Tripti Shahi",flood
246,2021-08-16 07:40:00+00:00,kathmandupost,"Cantilever bridge left unused after floods swept away approach way

The trail should be repaired to ease transportation of food and daily essentials, locals say.
https://t.co/GqM41Zgddf — by Hariram Upreti",flood
247,2021-07-17 06:03:55+00:00,kathmandupost,"As floods hit western Europe, scientists say climate change hikes heavy rain

A 1-degree rise in average global temperature increases the atmosphere’s capacity to hold water by 7percent, climate scientists have said.

https://t.co/ySyLhOdyMV",flood
248,2021-05-30 04:30:00+00:00,kathmandupost,"Rains brought by cyclone Yaas send flood displaced scrambling for shelter

Families displaced by last year’s flood in Dhorpatan Municipality of Baglung yet to receive government-announced relief.

https://t.co/exPE7g9Pt2 — by Prakash Baral",flood
249,2018-07-29 07:15:00+00:00,kathmandupost,"Transportation has come to a halt along Rasuwagadhi-Syaphrubesi road section--the only Nepal-China link road in operation--after rain-triggered floods damaged a bridge over Timure Ghattekhola in Rasuwa

#KathmanduPost

https://t.co/VJRUEUdwo8",flood
250,2021-10-21 12:15:00+00:00,kathmandupost,"Death toll in floods, landslips climbs to 77

Province 1 is hit hardest as unseasonal rainfall continues to claim lives, destroy crops.
https://t.co/u8wOPJ7xr5 — by Laxmi Gautam, Biplav Bhattarai &amp; Ramesh Chandra Adhikari",flood
251,2022-06-12 04:30:00+00:00,kathmandupost,"Flood of contraband sugar causing glut in market

Nepal’s annual sugar demand is 260,000 tonnes, the country produced 105,000 tonnes of the household sweetener in the last fiscal year.

https://t.co/wVqR5WcaOR — by @PrasainKrishana &amp; J Panday",flood
252,2019-04-01 12:15:00+00:00,kathmandupost,"Families displaced by Koshi floods in Sunsari four decades ago no longer have their lands and properties; yet they continue to pay land revenue tax in the hopes of receiving compensation from the government someday.

https://t.co/u3p5ZzpSR4",flood
253,2022-08-22 08:05:15+00:00,kathmandupost,"At least 20 dead in central Afghanistan floods

The Taliban government, which took over the country last August, has struggled to cope with the disasters and has called for assistance.

https://t.co/VTJ3ICLqfx",flood
254,2021-09-22 22:15:00+00:00,kathmandupost,"Bheri Babai project delayed due to damage

Hit by flood, the multi-basin irrigation-cum-hydropower project located in Surkhet is slated to be ready only in 2024.

https://t.co/jRMpqwAqHD — by Krishna Prasad Gautam &amp; Harihar Singh Rathore",flood
255,2021-01-04 03:45:00+00:00,kathmandupost,"Incidents of sexual assault unchecked in Surkhet’s flood-displaced camps.

A few cases get reported but a majority of them are settled within the camps, say families displaced by the 2014 floods.

https://t.co/oNA8wMsDPD — by Chandani Kathayat",flood
256,2020-02-28 08:15:00+00:00,kathmandupost,"Flood fear looms over villages close to vulnerable embankments in Rautahat

Government has not released funds to repair the embankments damaged in last year’s monsoon, officials say. https://t.co/QSklazCn3R — by Shiva Puri",flood
257,2018-07-16 22:58:00+00:00,kathmandupost,"Saptakoshi at red alert; flood hits Gobargadha
#KathmanduPost
https://t.co/Nl66qRoGgA",flood
258,2021-10-11 06:15:00+00:00,kathmandupost,"North Korea's Kim calls for improving people's lives amid 'grim' economy

North Korea's economy has been battered by years of sanctions over its nuclear and weapons programmes, and heavy rains and floods have also taken a toll.

https://t.co/9NOe4w1aKh",flood
259,2019-07-15 04:40:00+00:00,kathmandupost,"Before the heavy rains and floods that began on Thursday, pesticide and quarantine issues with India had also obstructed deliveries, causing a big gap in demand and supply that led to massive price hikes in key cities like Kathmandu. 
https://t.co/eznrI0KeCm — by @PrasainKrishana",flood
260,2022-08-28 05:05:00+00:00,kathmandupost,"Pakistan floods force tens of thousands from homes overnight

https://t.co/RlnMmcdJ3O",flood
261,2018-07-18 07:00:01+00:00,kathmandupost,"Govt fails to deliver relief to flood-affected Gobargadha
#KathmanduPost
https://t.co/XGdZHULnN0",flood
262,2018-07-17 08:07:34+00:00,kathmandupost,"Flood-affected Gobargada locals await rescue (In pictures)

#KathmanduPost

https://t.co/HMpHryAFrY https://t.co/2r6KQPdasT",flood
263,2019-07-04 05:00:00+00:00,kathmandupost,"Forest officials said that the forest cover in Kailali has been decreasing due to illegal settlements built by flood-displaced families

https://t.co/J3B6Z3iq9u — by Mohan Budhaair",flood
264,2022-01-30 05:15:00+00:00,kathmandupost,"Continuous snowfall since December disrupts supply chains in Saipal

First the November floods affected food supply, then came snowfall. Now villagers face a looming shortage of essentials.

https://t.co/7lwpnn1t3J — by @bajhangimitra",flood
265,2019-04-05 06:35:00+00:00,kathmandupost,"With monsoon only a couple of months away, people living in the immediate vicinity of Bagmati and Lalbakaiya rivers in Rautahat district are in fear of floods wreaking destruction in their settlements

https://t.co/OzfbtrwJlo",flood
266,2020-07-11 14:11:51+00:00,kathmandupost,"Nine killed, six missing and two seriously injured in floods and landslides in Barekot, Jajarkot in the past three days

The monsoon-induced disasters have displaced at least 300 families in the rural municipality. https://t.co/cMGBZIZjIU — by Bhim Bahadur Singh",flood
267,2019-09-23 09:15:00+00:00,kathmandupost,"Two children swept away by floods triggered by heavy rains in Beni, the  district headquarters of Myagdi, on Saturday night. 
https://t.co/3BruCZjm6K— by Ghanashyam Khadka",flood
268,2018-08-10 23:15:00+00:00,kathmandupost,"Flood forces Mohanpur residents to flee to India 

https://t.co/ZjAiny3i7R",flood
269,2021-06-14 05:45:00+00:00,kathmandupost,"Repair works of damaged embankments at final stage

Floods in Bagmati and Lalbakaiya rivers had breached embankments and inundated settlements in Rautahat last year.

https://t.co/SY9QFGf2Cm — by Shiva Puri",flood
270,2021-09-03 23:15:00+00:00,kathmandupost,"Sindhupalchok flood victims migrate out of the district to seek livelihood

Around 700 flood-displaced families of Helambu and Melamchi have moved to other cities since the disaster.

https://t.co/C2lzDUYMPG — by Anish Tiwari",flood
271,2022-10-12 00:15:00+00:00,kathmandupost,"Children in northern Darchula deprived of mid-day meal

Scores of students have been left without the government-provided mid-day meal as landslides and floods disrupt food supply from the district headquarters.

https://t.co/l41dWAg8Kx — by Manoj Badu",flood
272,2021-07-02 09:00:00+00:00,kathmandupost,"The Melamchi Water Supply Project, which was significantly damaged due to floods nearly two weeks ago, is headed into uncertainty as officials are not sure when the repair work will start. https://t.co/kzTBOP8KAw — by @CK_Mandal",flood
273,2021-11-12 06:55:00+00:00,kathmandupost,"October floods and landslides disrupt water supply in Bajhang

Around 20,000 families are left without safe drinking water, which could lead to outbreak of diseases. https://t.co/jqZNQ8eH1b — by @bajhangimitra",flood
274,2022-04-21 05:35:00+00:00,kathmandupost,"Bajhang folk fear disconnect from national road network

The district was disconnected from the national road network for about a month in October last year as the floods and landslides severely damaged Jaya Prithvi Highway. https://t.co/RpjSYUVzE6 — by @bajhangimitra",flood
275,2021-07-16 18:45:00+00:00,kathmandupost,"Continuous rainfall affects normal life in several districts

Heavy rains in Kailali flood rivers and streams displacing scores of families.

https://t.co/ycNnMu4wgp — by Mohan Budhaair",flood
276,2022-10-21 13:45:00+00:00,kathmandupost,"Nepal to talk up climate losses and seek more funding at COP27

Some 400,000 people were displaced from 2008 to 2014 due to climate change-induced floods, landslides in Nepal.

https://t.co/VxfEHNkRLB — by @poudeel_puru",flood
277,2020-07-17 18:30:00+00:00,kathmandupost,"OPINION: The invisible pandemic

From 2015-18, a total of 27,000 families were affected by floods and landslides and 721 lives were lost. https://t.co/OSTVkqFMgz — by @madhukaru",flood
278,2023-05-01 03:15:00+00:00,kathmandupost,"Landslide in Arun III dam highlights threats to Nepal’s hydropower projects

Officials say risk of flash flood has subsided as the river overflows from the project’s dam.

https://t.co/UjKMBf7iJF — by @arjunpoudeltkp",flood
279,2022-05-19 06:55:00+00:00,kathmandupost,"More than 500,000 people have fled their homes in India’s northeastern state of Assam to escape heavy floods triggered by pre-monsoon rains that drowned seven, authorities said on Wednesday, as they warned the situation could worsen.

https://t.co/rklm7zYT9E",flood
280,2020-09-26 23:05:00+00:00,kathmandupost,"Flood victims in Surkhet await resettlement for past six years

Only a few families have received half the grant announced by the provincial government while the rest have received none. https://t.co/PH0w1vGkCm — by Chandani Kathayat",flood
281,2021-07-23 08:05:00+00:00,kathmandupost,"Floods damage arable land in Pyuthan every monsoon

Farmers in Pyuthan Municipality are seeking government help to protect their fields that the Jhimruk river has been turning into dry desolate land.
https://t.co/IAdcgz7FEJ — by Shamsher Bikram GC",flood
282,2021-08-30 16:30:00+00:00,kathmandupost,"Nine dead, 90,000 affected as heavy rains over past three days trigger floods, landslides

Meteorological office predicts heavy rainfall in Province 1, Bagmati, Gandaki and parts of Sudurpaschim until Tuesday.
https://t.co/enpt6WdF2B — by @AnupOjha7",flood
283,2022-10-11 06:15:00+00:00,kathmandupost,"Children in northern Darchula deprived of mid-day meal

Scores of students have been left without the government-provided mid-day meal as landslides and floods disrupt food supply from the district headquarters.
https://t.co/4o8WjI8fRC — by Manoj Badu",flood
284,2023-01-30 05:00:00+00:00,kathmandupost,"New Zealand counts cost of Auckland floods, more rain forecast

Metservice is forecasting further heavy rains to hit the already sodden city late on Tuesday.

https://t.co/O2Egn3ml36",flood
285,2021-08-31 17:45:00+00:00,kathmandupost,"Floods, landslides continue to wreak havoc

Three persons died, two others have gone missing in Duhun Rural Municipality of Darchula district in the past 24 hours.

https://t.co/fbak3aIgJW — by Manoj Badu",flood
286,2021-07-03 00:45:00+00:00,kathmandupost,"The Melamchi Water Supply Project, which was significantly damaged due to floods nearly two weeks ago, is headed into uncertainty as officials are not sure when the repair work will start. 

https://t.co/aPy9kFjzk3 — by @CK_Mandal",flood
287,2023-05-17 09:15:00+00:00,kathmandupost,"Women with bicycles on their heads ford the Babai river at Jabdhighat in Bardiya in this recent photo. The bridge, built by Pappu Construction, was damaged before it was handed over to the authorities five years ago and was destroyed in last year’s floods.

Photo by: Kamal Panthi https://t.co/Die32DKnOA",flood
288,2019-04-01 23:45:00+00:00,kathmandupost,"Koshi flood victims pay tax for inundated land in hopes of receiving compensation from the government someday

https://t.co/u3p5ZzpSR4",flood
289,2021-11-12 00:15:00+00:00,kathmandupost,"Salleri residents demand relocation from flood-ravaged village

More than a dozen houses in Salleri are at risk of displacement by landslides and floods.

https://t.co/OGTS0FgASn — by Hariram Upreti",flood
290,2021-06-14 22:45:00+00:00,kathmandupost,"Repair works of damaged embankments at final stage

Floods in Bagmati and Lalbakaiya rivers had breached embankments and inundated settlements in Rautahat last year.

https://t.co/7WukquSeY4 — by Shiva Puri",flood
291,2021-09-03 17:15:00+00:00,kathmandupost,"At least nine people dead in separate incidents of floods and landslides

Road sections in Pokhara of Gandaki Province have started to cave in after continuous rainfalls for the last few days.

https://t.co/PyhxotaleL — by Durga Lal KC &amp; @abstractdpak",flood
292,2022-08-05 01:45:00+00:00,kathmandupost,"EDITORIAL: Deluge and after

The marginalised population should not be left behind while providing flood victims with relief.

https://t.co/UecdhRfvYf",flood
293,2022-09-18 02:35:00+00:00,kathmandupost,"Eye-watering deaths and destruction out west

21 dead, two missing in late-monsoon floods and landslides in Sudurpaschim and Lumbini provinces. Continuous rainfall has disrupted rescue efforts.

https://t.co/1Fj1U2lynl — by @menukadhungana2",flood
