,Date,User,Tweet,Keyword
98,2019-07-29 05:30:00+00:00,kathmandupost,"While traders say the flood and landslides in key vegetable producing areas has affected production, consumer rights activists say middlemen are hiking up prices on the pretext of natural disasters. 
//bit.ly/2GBy6GJ — by @PrasainKrishana",flood
99,2020-07-14 15:43:47+00:00,kathmandupost,Two persons went missing and two others were injured after being swept away by a flood in one of the tunnels of Melamchi Water Supply Project in Sindhupalchok district on Tuesday. https://t.co/uP7Vxpw7kr — by Anish Tiwari,flood
100,2019-07-14 08:26:28+00:00,kathmandupost,"According to Nepal Police, the death toll from floods and landslides since Friday has reached 50 as of Sunday afternoon. These photos show the extent of damage and devastation caused by the rain. https://t.co/IiDWFWvuS3",flood
101,2019-07-17 04:23:00+00:00,kathmandupost,"Leaders say they have been working to settle the issue through dialogue, and talks will intensify once leaders return from flood-affected districts

https://t.co/K78Q8kk4Qj — by @tikapradhan",flood
102,2019-10-05 20:15:00+00:00,kathmandupost,"As Dashain shoppers flood core areas in Kathmandu, traffic worsens https://t.co/brLQh1RXp6 — by @AnupOjha7",flood
103,2020-07-09 04:36:39+00:00,kathmandupost,"15 houses washed away, two dead and 18 go missing as rains trigger floods in Sindhupalchok

With roads damaged, rescue teams are forced to take alternative routes to reach the incident site.

https://t.co/RtZXeaGhmd",flood
104,2022-12-09 19:45:00+00:00,kathmandupost,"Paddy production hit after flooding becomes more frequent in Bhajani

Nearly 20,000 families were affected by the floods and inundation in several districts in September. 

https://t.co/uumQHaRXVM — by  Mohan Budhaair",flood
105,2021-08-04 05:45:00+00:00,kathmandupost,"Chhangru, Tinkar cut off from district headquarters

Floods and landslides have severely damaged the foot trail linking the villages to the rest of the district, local residents say.

https://t.co/ANx3xvXuo8 — by Manoj Badu",flood
106,2020-07-21 04:00:00+00:00,kathmandupost,"Rain-swollen Bagmati threatens squatter settlement in Thapathali

First it was the coronavirus lockdown and now it is the fear of flood and water-borne diseases that haunt these poor families.

https://t.co/Yke05MWRds — by @AnupOjha7",flood
107,2021-08-30 04:45:00+00:00,kathmandupost,"Nine dead, 90,000 affected as heavy rains over past three days trigger floods, landslides

Meteorological office predicts heavy rainfall in Province 1, Bagmati, Gandaki and parts of Sudurpaschim until Tuesday.

https://t.co/TgpKqekpKg — by @AnupOjha7",flood
108,2018-07-19 06:40:00+00:00,kathmandupost,"Landslides and floods triggered by heavy rains at least killed four people, injured six others and displaced scores of families in Gorkha, Parbat and Baglung and Darchula districts

#KathmanduPost

https://t.co/cuN2yN2Oyj",flood
109,2022-01-15 02:15:00+00:00,kathmandupost,"Lockdown, unseasonal floods and loss in quality dealt triple blow to paddy farmers

https://t.co/aVEmpj2SXk — by Ganesh Chaudhary &amp; Shankar Acharya",flood
110,2021-06-25 07:00:00+00:00,kathmandupost,"Floods continue to wreak havoc in Manang

Marshyangdi River has been gaining strength since Tuesday night following heavy rainfall.
https://t.co/ch8d1vfRue — by Aash Gurung",flood
111,2019-07-18 03:50:00+00:00,kathmandupost,"From droughts in Upper Mustang to floods in the southern plains, there are indications all around that the country is already dealing with adversities created by climate change. 

https://t.co/53RN4tY3Cl — by @CK_Mandal",flood
112,2021-11-01 02:15:00+00:00,kathmandupost,"Jump in inflation sparks worries about economic recovery

October floods have made some food items costlier for consumers already feeling heat of rising energy prices.

https://t.co/i3hZj1SAup — by @PrasainKrishana",flood
113,2019-08-20 08:05:00+00:00,kathmandupost,"The government authorities are yet to erect five boundary pillars along the Nepal-India border that had collapsed in floods last month.
Fearing possible border disputes, the locals worry that the collapsed border pillars might gradually be swept away.  https://t.co/DgkTVFJKxF",flood
114,2019-07-23 07:01:00+00:00,kathmandupost,"Floods and landslides have wreaked so much havoc at Limchungbung Rural Municipality in Udayapur that the local unit has been declared a crisis zone.
https://t.co/uURzCDuAWI — by Dilliram Khatiwada",flood
115,2020-07-11 02:03:06+00:00,kathmandupost,"Rescue teams have yet to reach the disaster site in Myagdi as roads have been blocked by both landslide debris and flash floods

https://t.co/5AbBt0lbvS — by Lal Prasad Sharma",flood
116,2019-08-16 05:51:00+00:00,kathmandupost,"Bagmati Hydroelectric Project resumed operation on Thursday after being out of commission for over a month. The 22 MW project had been devastated by a flood and the ensuing landslide on July 12.
https://t.co/TaCU4GmOFz — by Pratap Bista",flood
117,2022-08-30 04:45:00+00:00,kathmandupost,"Early estimates put the damage from Pakistan’s recent deadly floods at more than $10 billion, its planning minister said on Monday, adding the world has an obligation to help the South Asian nation cope with the effects of man-made climate change.

https://t.co/tABgGJrFop",flood
118,2018-07-12 10:38:20+00:00,kathmandupost,"Making fun of Bhaktapur floods is insult to its people: Basnet

https://t.co/CXTxv2JoRw",flood
119,2018-07-21 04:35:00+00:00,kathmandupost,"Dam in India floods rice fields in Kapilvastu

https://t.co/U9QlFwR7KR",flood
120,2022-09-13 03:45:00+00:00,kathmandupost,"Nepal to provide relief materials worth Rs20 million to flood-hit Pakistan

Pakistan has been severely affected by floods which have killed nearly 1,400 people and displaced more than a million this monsoon.

https://t.co/IdAtin4w59",flood
121,2020-08-03 15:05:00+00:00,kathmandupost,"Flood-displaced families in Kailali living by the roadside

Almost a week into the disaster, more than 200 families from Bhajani have pitched tents along the Postal Highway awaiting relief and safe return to their homes. https://t.co/o1gltwyqrX — by Mohan Budhaair",flood
122,2020-07-03 22:45:00+00:00,kathmandupost,"Fertile fields in Morang face inundation due to lack of proper drainage system

Construction of a railway line along Bathnaha in India to Katahari in Nepal has put many villages at risk of floods.
https://t.co/fSe8oC6gJX — by Deo Narayan Sah",flood
123,2019-04-01 07:15:00+00:00,kathmandupost,"Koshi flood victims pay tax for inundated land 

https://t.co/u3p5ZzpSR4",flood
124,2018-08-31 03:00:00+00:00,kathmandupost,"#Opinion Plan and prepare: Floods should not be forgotten after the monsoon because they are a national issue, by Madhukar Upadhya

https://t.co/rJz963WdDK",flood
125,2021-07-09 07:25:00+00:00,kathmandupost,"Continuous floods, landslides obstruct Manaslu foot trail

Risk of food shortage has increased as villages remain cut off from the rest of the district for the past three weeks. https://t.co/C4PPv8S1GH — by Hariram Upreti",flood
126,2021-02-03 23:15:00+00:00,kathmandupost,"Flood, landslide-displaced Baglung villagers still wait for new houses https://t.co/f9aBmxreMn — by Prakash Baral",flood
127,2021-08-27 13:37:52+00:00,kathmandupost,"Ratu River has inundated around 900 houses in Tilgadh since Thursday night

The settlement in Balwa Municipality-4 is one of the most affected areas by floods every year.

https://t.co/ad0nMCf2oB — by Sunita Baral",flood
128,2021-06-16 14:46:26+00:00,kathmandupost,"One dead, seven missing in Sindhupalchok flood

Floodwaters from the Melamchi River entered settlements causing damage to houses and bridges in the Melamchi bazaar area.

https://t.co/GX6eZsHnhY — by Anish Tiwari",flood
129,2021-07-01 16:19:06+00:00,kathmandupost,"Six dead, three missing as floods and landslides wreak havoc in various districts

https://t.co/VULjyKsAve — by Ramesh Kumar Paudel &amp; Samjhana Rasaili",flood
130,2019-07-22 06:55:00+00:00,kathmandupost,"The cost of rehabilitation and recovery of the roads and bridges damaged by recent floods will be around Rs220 million, according to the initial estimate of the Department of Roads. 
https://t.co/6SBXvZn1ji — by @journoprithvi",flood
131,2021-06-24 04:20:00+00:00,kathmandupost,"Siltation in Kaligandaki river affects settlements and arable lands in Mustang

Erosion of the banks and siltation gain momentum during the monsoon, which can lead to floods and inundation. https://t.co/keI7xQbexE — by Ghanshyam Khadka",flood
132,2022-07-26 04:45:00+00:00,kathmandupost,"Floods, landslides destroy shops, displace households in Dolakha

Over 30 families have been displaced as a landslide lashes Shailung Rural Municipality’s ward 8. https://t.co/XLJKhqIsWV — by Kedar Shiwakoti",flood
133,2022-05-20 03:15:00+00:00,kathmandupost,"Increasing concrete cover in Valley causing more urban floods

Experts for building infiltrating ponds to avert flood disasters and recharge groundwater.
https://t.co/SB9XfU029E — by @Aakritigg",flood
134,2020-07-30 08:30:00+00:00,kathmandupost,"Hundreds of families displaced as floodwaters enter settlements in eastern Kailali

Floods triggered by incessant rains have entered various settlements, prompting authorities to relocate affected families to safer places.
https://t.co/43e8DTTnxm Mohan Budhaair",flood
135,2023-05-06 06:45:00+00:00,kathmandupost,"Nepal, Bangladesh to sign an MoU on real time data sharing on weather and floods

This will be the first time that Nepal would share its data on floods and weather with another country.

https://t.co/ycBiESEqkK — by @journoprithvi",flood
136,2021-06-20 06:45:00+00:00,kathmandupost,"Families displaced by Melamchi floods refuse Covid-19 tests fearing separation

Around 600 people in Melamchi and 400 in Helambu are living in makeshift camps for flood displaced.

https://t.co/WhUsNYwjcp — by @arjunpoudeltkp",flood
137,2021-07-01 20:15:00+00:00,kathmandupost,"Koshi Tappu residents protest decision to turn their homesteads into leasehold forest

The proposed area is home to 500 families, mostly flood and landslide victims, squatters and impoverished households.

https://t.co/4GUZmOfoFE — by Dilliram Khatiwada",flood
138,2020-08-21 06:25:00+00:00,kathmandupost,"Search team on Thursday recovered two more bodies of the flood victims who were swept away by the rain-swollen Kailash stream in Saini Bazaar, Achham, on Tuesday night.
https://t.co/IZxH2sueD7 — by @menukadhungana2",flood
139,2020-07-24 22:45:00+00:00,kathmandupost,"Vegetable prices rise sharply in the Valley as Tarai floods slash supply

Traders say prices would likely remain on the high side until the next harvest due in about three months. https://t.co/hrQfgTJLsa — by @PrasainKrishana",flood
140,2021-03-21 10:05:28+00:00,kathmandupost,"Heavy rains in Australia's east bring worst floods in 50 years

https://t.co/ahzsOgu2oO https://t.co/DiFYEAg7ff",flood
141,2018-12-06 03:20:00+00:00,kathmandupost,"New concrete houses are being built despite government assessment reports of increased landslide and flood risks in this idyllic hub devastated by the earthquake of April 25, 2015

https://t.co/oc7gRgQi5C",flood
142,2022-11-01 14:45:00+00:00,kathmandupost,"Between droughts and deluges

Nepal has of late witnessed deluges, unseasonal flash floods and landslides, long droughts and avalanches. https://t.co/irutSIli0C — by @arpanshr",flood
143,2019-09-03 06:10:00+00:00,kathmandupost,"In the second week of July, most of the districts of Province 2 were inundated by floodwater. Dozens of people died; hundreds were injured and displaced from their homes due to flood and landslides triggered by incessant rainfall. 
https://t.co/CrKUdc47O1 — by @arjunpoudeltkp",flood
144,2020-08-22 00:45:00+00:00,kathmandupost,"Karnali government’s Integrated Settlement Development Programme fails to move beyond paper

Under the programme, settlements at high risk of floods and landslides were to be moved to safer locations.

https://t.co/rMHIMyHgxj — by Kalendra Sejuwal",flood
145,2020-06-25 22:45:00+00:00,kathmandupost,"Narainapur might have dodged the worst effects of Covid-19 but as the rainy season sets in, the fear of a flood haunts villagers. https://t.co/UFlRRxYr2k — by Madhu Shahi &amp; Rupa Gahatraj",flood
146,2020-08-21 08:55:00+00:00,kathmandupost,"Karnali government’s Integrated Settlement Development Programme fails to move beyond paper

Under the programme, settlements at high risk of floods and landslides were to be moved to safer locations.
https://t.co/rMHIMyHgxj — by Kalendra Sejuwal",flood
147,2021-07-05 23:15:00+00:00,kathmandupost,"Badaharwa residents living in tents after their homes were inundated

It has been raining continuously for the past few days, leaving several settlements at risk of floods and inundation.

https://t.co/vZ4j0iHwkV — by Shiva Puri",flood
148,2021-06-16 06:07:03+00:00,kathmandupost,"UPDATE: Bodies of seven people, who were missing after floods in Sindhupalchok district since Tuesday, have been recovered on Wednesday. https://t.co/GX6eZsHnhY — by Anish Tiwari",flood
149,2021-09-17 06:55:00+00:00,kathmandupost,"Darchula school running its classes from tents after last year’s floods and landslides

Around 124 students of Samaiji Basic School have been affected as they do not have proper classrooms.
https://t.co/t1yLnLXN3Y — by Manoj Badu",flood
150,2021-08-16 14:15:00+00:00,kathmandupost,"Geological study finds 13 settlements of Bahrabise at high risk of landslides, floods

The study team has recommended the relocation of 5,000 households in several settlements that are at risk.

https://t.co/1BKMpsTA8O — by Anish Tiwari",flood
151,2021-08-01 09:09:42+00:00,kathmandupost,"Saturday night floods in Melamchi caused significant infrastructure damage

Around a dozen houses were swept away by floods in Melamchi Bazaar and Kuil village. Several other buildings and infrastructure also suffered damages.

https://t.co/9fTlqdzY93 — by Anish Tiwari",flood
152,2021-08-21 14:45:00+00:00,kathmandupost,"Landslide debris blocks river in Bajhang, triggers flood threats

Continuous landslide at Githine cliff in Bungal Municipality has hindered work to safely channelise the blocked river.

https://t.co/Q0EixBhtYc — by @bajhangimitra",flood
153,2021-07-21 04:20:00+00:00,kathmandupost,"Central Chinese province swamped after heaviest rain in 1,000 years

In Zhengzhou, a city of over 12 million on the banks of the Yellow River, 12 people have died so far amid the floods, and about 100,000 people have been evacuated to safe zones.

https://t.co/2DvDFvJD63",flood
154,2019-10-24 07:55:00+00:00,kathmandupost,Flood control works in the Koshi and Bakraha rivers of Province 1 have hit a snag owing to a lack of budget. https://t.co/DoxzVnv6th — by Deo Narayan Sah,flood
155,2022-03-29 09:45:00+00:00,kathmandupost,"Heavy rains drenched east Australia on Tuesday, triggering evacuation orders for thousands of flood-weary residents for the second time this month as authorities warned the intense weather is likely to persist for the next 24 hours.

https://t.co/T0Yj484TgJ",flood
156,2019-06-29 06:05:00+00:00,kathmandupost,"The people of Beni Bazaar, the district headquarters of Myagdi, live under threat of possible floods and landslides every monsoon. 

https://t.co/nX2whUAYHM",flood
157,2021-06-23 23:15:00+00:00,kathmandupost,"Manang’s Naso Rural Municipality setting up temporary office at Besisahar after flood

Dharapani, the administrative headquarters of the rural municipality, was badly damaged by the flooded Marsyangdi river in the second week of June.

https://t.co/nOCbKeoto6 — by Aash Gurung",flood
158,2021-08-30 03:42:53+00:00,kathmandupost,"All of New Orleans, Louisiana's most populous city, had power knocked out due to ""catastrophic transmission damage,"" the local utility reported, hours after flash-flood warnings were posted.

https://t.co/rGG4CN7A83",flood
159,2020-07-24 07:47:00+00:00,kathmandupost,"Vegetable prices increased sharply in the Kathmandu Valley on reduced deliveries as furious floods following nonstop rain ravaged key producing areas, damaging crops and disrupting transportation

https://t.co/hrQfgTsaAC — by @PrasainKrishana",flood
160,2020-07-10 03:15:00+00:00,kathmandupost,"Thirty-six homes washed away in Bhotekoshi flood, 20 individuals still missing

The swollen Bhotekoshi also swept away bridges and road sections on the Araniko Highway, complicating relief efforts.
https://t.co/BkEPkCjCuc — by Anish Tiwari",flood
161,2021-02-07 09:20:00+00:00,kathmandupost,"As many as 150 people were feared dead after a Himalayan glacier broke and crashed into an Indian dam early on Sunday, with floods forcing the evacuation of villages downstream.

https://t.co/0KrFcaE83T",flood
162,2018-11-19 08:15:00+00:00,kathmandupost,"The government’s failure to build an embankment on the river has also compelled the locals to live amid fear of flood and erosion every monsoon

https://t.co/O1UWQa426M",flood
163,2021-10-23 03:30:00+00:00,kathmandupost,"Hydropower projects largely spared by latest floods, landslides

Besides three projects developed by Kalanga Hydro Pvt Ltd in Bajhang district, there has been no report of major damage to hydropower projects.

https://t.co/pRUXX8mkur — by @journoprithvi",flood
164,2022-07-31 03:55:00+00:00,kathmandupost,"India and Bangladesh seek to sign deal on real-time flood data sharing with Nepal

After the meeting between Nepal and Bangladesh on Thursday, a bilateral meeting between Nepal and India is expected in early September.

https://t.co/tj5UYoYDqH — by @journoprithvi",flood
165,2019-09-05 04:15:00+00:00,kathmandupost,Water-induced disasters continue to wreak havoc more than any other disaster in the country. https://t.co/HRM4HPYQFD — @CK_Mandal explains why floods and landslides batter Nepal every year,flood
166,2019-08-07 07:03:00+00:00,kathmandupost,"Most victims find their names missing from the flood victims roster, despite having submitted their names weeks ago

https://t.co/gdFkBWKOWI — by Bharat Jargha Magar",flood
167,2021-09-07 14:45:00+00:00,kathmandupost,"Not just rains, poor urban planning causing flash floods in Kathmandu

Rampant river encroachment, unmanaged constructions and bad drainage to blame, experts say.
https://t.co/WxZ6ib76uJ — by @AnupOjha7 &amp; @dhungana_shuvam",flood
168,2018-07-16 10:45:00+00:00,kathmandupost,"The recent flood, landslide and inundation in Bhaktapur has damaged property worth Rs 119.35 million: Bhaktapur District Administration Office

#KathmanduPost

https://t.co/fhI9NlMW8d",flood
169,2019-04-15 10:45:00+00:00,kathmandupost,"Triyuga River’s flood renders many landless every year 

https://t.co/Rf7ts4jlBP",flood
170,2021-07-01 08:45:00+00:00,kathmandupost,"Lumbini turns to bamboo to tame rivers

Bamboo plantation campaign underway in all 12 districts of the province to form biological embankments in order to prevent erosion and flood.
https://t.co/1yrZ77shT6 — by Madhab Aryal",flood
171,2023-04-10 18:45:00+00:00,kathmandupost,"Chinese companies showing little interest in power summit

Indian companies are expected to flood the event being held in Kathmandu on April 18-19.

https://t.co/Vt3xv850pb — by @journoprithvi",flood
172,2020-08-10 04:45:00+00:00,kathmandupost,"OPINION: Down to the water

Hailing from Madhubani, I have seen how floods have made farming and forestry unviable livelihood options. https://t.co/6GLhpRRMNu — by @atul_mdb",flood
173,2018-09-17 10:15:00+00:00,kathmandupost,"Immediate relief support was provided to four families affected by the floods and 12 families who lost their houses to landslides in Marsyangdi Rural Municipality.

https://t.co/GaC7MDe0OI",flood
174,2021-02-18 09:22:29+00:00,kathmandupost,"High probability of Uttarakhand-scale flood in Bhutan

The government has identified 17 potentially dangerous lakes in the country. 

https://t.co/11L4Clws5z — via Asia News Network",flood
175,2022-12-15 05:47:28+00:00,kathmandupost,"Residents of Congo’s capital mourn after deadly floods and landslides

Congo’s President Felix Tshisekedi has declared three days of national mourning.

https://t.co/4M1j2M8wek",flood
176,2022-07-18 16:45:00+00:00,kathmandupost,"Two years after disasters, displaced families are still living in makeshift settlements

In 2020, a provincial ministry paid 26 times more in helicopter fares than what it spent on relief for Sindhupalchok flood and landslide victims. https://t.co/vXd2Thtc8p — by @arjunpoudeltkp",flood
177,2022-02-26 02:30:00+00:00,kathmandupost,"Flood victims in Bajhang decry government apathy

Floods victims in the district have been seeking rehabilitation in safe locations for the past two decades but no help has been forthcoming, locals say.

https://t.co/5ywZUKJu5Y — by @bajhangimitra",flood
178,2020-08-04 15:45:00+00:00,kathmandupost,"Road infrastructure across the country have sustained damages worth over Rs2 billion this monsoon, as landslides and floods were reported in more than 150 locations along various national highways

https://t.co/DW9GRJ3LtZ — by @journoprithvi",flood
179,2022-06-21 15:15:28+00:00,kathmandupost,"Floods swamp more of Bangladesh and India, millions marooned

Extreme weather in South Asia has become more frequent in and environmentalists warn that climate change could lead to ever more serious disasters.

https://t.co/DZLKQPFZdr",flood
180,2021-10-21 02:05:00+00:00,kathmandupost,"Death toll in floods, landslips climbs to 77

Province 1 is hit hardest as unseasonal rainfall continues to claim lives, destroy crops.
https://t.co/2YLCtI5G5w — by Laxmi Gautam, Biplav Bhattarai &amp; Ramesh Chandra Adhikari",flood
181,2020-07-20 13:01:05+00:00,kathmandupost,"A section of Prithvi Highway has been swept away by flood in Rorang Rural Municipality, Dhading following heavy rainfall on Monday

https://t.co/wrJghEzPCj",flood
182,2021-06-17 12:45:00+00:00,kathmandupost,"Flood devastation in Melamchi not only because of rains

Experts say the mayhem in the first week of monsoon is quite concerning and with ‘above normal’ rainfall predicted this time, the situation could go worse.

https://t.co/UhY6HYKoeL — by @CK_Mandal",flood
183,2022-06-25 01:50:00+00:00,kathmandupost,"Monsoon means disaster in Madhes Province

Several settlements in Rautahat and Saptari face yearly displacement and loss of lives and properties caused by floods and inundation.

https://t.co/pKpo9YKJ1y — by Shiva Puri &amp; Abadhesh Kumar Jha",flood
184,2018-07-14 04:05:00+00:00,kathmandupost,"Flood victims help one another as they try to recover from disaster;
Over 500 homes still submerged in Bhaktapur
#KathmanduPost 
https://t.co/iOzKpsDTG4",flood
185,2023-04-10 06:15:00+00:00,kathmandupost,"Farmers suffer as floods wipe out farms in Jumla annually

The irrigation channels damaged by the floods last year have not been repaired.

https://t.co/kNVHh52ZtE — by DB Budha",flood
186,2021-08-27 00:45:00+00:00,kathmandupost,"Disaster preparedness sorely lacking in Karnali Province

Floods and landslides take lives and ravage properties in the province every year. Many people say the severity can be mitigated by prioritising preparedness.

https://t.co/ZkCBRaTqTu — by Chandani Kathayat",flood
187,2022-07-09 22:15:00+00:00,kathmandupost,"People of settlements prone to landslides and floods in Sindhupalchok living in abject fear

https://t.co/pNHJxWpbRB — by Anish Tiwari",flood
188,2021-09-02 00:45:00+00:00,kathmandupost,"Bajura cut off from national road network for two months

Floods and landslides since mid-June have damaged the Sanfe-Martadi road section at several places. 

https://t.co/lCG3dJBWF0 — by Arjun Shah",flood
189,2020-07-29 10:35:53+00:00,kathmandupost,"Hundreds of families have been displaced from their homes after flood swelled rivers entered several settlements in the eastern parts of Kailali district owing to incessant rains since Tuesday night.
https://t.co/43e8DTBM8M — by Mohan Budhair",flood
190,2021-09-03 04:35:00+00:00,kathmandupost,"At least nine people dead in separate incidents of floods and landslides

Road sections in Pokhara of Gandaki Province have started to cave in after continuous rainfalls for the last few days.
https://t.co/6eKYoA4Mvd — by Durga Lal KC &amp; @abstractdpak",flood
191,2019-12-27 04:55:00+00:00,kathmandupost,"More than 200 flood-displaced families of Inarwa, in Janaknandani, are living under flimsy huts, battling bone-chilling cold every night. https://t.co/EDkWIYqSd6 — by Shahiman Rai",flood
192,2019-02-13 06:15:00+00:00,kathmandupost,"One hundred and thirty flood affected families of Tirahut Rural Municipality-2 and 5 in Saptari district have been living with hardships after the floodwaters of Mahuli stream swept away their houses in June, 2017

https://t.co/Nsc61tnPHx",flood
193,2018-07-15 12:15:00+00:00,kathmandupost,"A 12-year-old boy has gone missing while trying to collect logs swept away by flood waters in the Narayani river in West Nawalparasi on Saturday

#KathmanduPost

https://t.co/JRCsA6nsIK",flood
194,2023-02-22 04:35:00+00:00,kathmandupost,"Bajhang flood victims struggling for justice for over two decades

Around 165 families were relocated to Kailali but 20 years later, they are still landless. https://t.co/xcszY0qfFU — by DR Pant",flood
195,2021-08-30 23:15:00+00:00,kathmandupost,"Floods, landslides obstruct foot trails in northern Gorkha

Chhekampar and Chumchet have been cut off from rest of the district, disrupting supply of food and daily essentials. https://t.co/j8QhSq7pUP  — by Hariram Upreti",flood
